{
  "$schema": "https://json-schema.org/draft/2020-12/schema",
  "$id": "https://runner.local/schemas/task_tree/v1.schema.json",
  "title": "Task Tree v1",
  "$ref": "#/$defs/node",
  "$defs": {
    "node": {
      "type": "object",
      "additionalProperties": false,
      "required": [
        "id",
        "order",
        "title",
        "goal",
        "acceptance",
        "passes",
        "attempts",
        "max_attempts",
        "children"
      ],
      "properties": {
        "id": {
          "type": "string",
          "minLength": 1
        },
        "order": {
          "type": "integer"
        },
        "title": {
          "type": "string"
        },
        "goal": {
          "type": "string"
        },
        "acceptance": {
          "type": "array",
          "items": {
            "type": "string"
          }
        },
        "passes": {
          "type": "boolean"
        },
        "attempts": {
          "type": "integer",
          "minimum": 0
        },
        "max_attempts": {
          "type": "integer",
          "minimum": 0
        },
        "children": {
          "type": "array",
          "items": {
            "$ref": "#/$defs/node"
          }
        }
      }
    }
  }
}
